{
  "schema_version": "1.0",
  "request_id": "ctrl-register-001",
  "trace_id": "trace-control-001",
  "caller_ref": "host:private-companion",
  "runtime_scope": {
    "ecosystem_id": "astrbot",
    "installation_id": "install-1",
    "runtime_instance_id": "runtime-1",
    "host_kind": "astrbot_host",
    "host_id": "host-1",
    "bot_id": "bot-1",
    "platform": null,
    "account_id": null,
    "conversation_ref": null,
    "platform_conversation_id": null,
    "conversation_id": null,
    "session_id": null,
    "user_id": null,
    "group_id": null,
    "persona_id": "persona-1",
    "persona_binding_revision": 3
  },
  "deadline_at": "2026-09-08T12:00:05Z",
  "idempotency_key": "register:world:1",
  "expected_control_revision": null,
  "method": "register",
  "manifest": {
    "extension_id": "world-simulation",
    "extension_version": "1.0.0",
    "provider_id": "world-provider-1",
    "provider_generation": "gen-1",
    "manifest_revision": 0,
    "host_kinds": ["plugin_hosted", "standalone_service"],
    "capabilities": [{
      "capability_id": "world.model.query",
      "capability_version": "1.0",
      "provider_id": "world-provider-1",
      "provider_generation": "gen-1",
      "descriptor_revision": 0,
      "owner_ref": "world-owner:persona-1",
      "status": "validated",
      "admission": true,
      "side_effect": "none",
      "features": ["bounded_projection"],
      "required_permissions": ["world.read"],
      "input_schema": null,
      "output_schema": null,
      "limits": {"max_input_bytes": 32768, "max_output_bytes": 65536, "max_concurrency": 4},
      "expires_at": null
    }],
    "dependencies": [],
    "resource_limits": {"max_metadata_bytes": 262144, "max_bindings": 32, "max_control_inflight": 16, "max_persistent_receipts": 1024}
  }
}
